{
  "schemaVersion": 1,
  "name": "LogVerdict rule regression fixtures",
  "updated": "2026-08-01",
  "notes": "One minimal signature per rule, resolved against the shipped database by the test suite. origin=observed means the signature was captured from a real machine; origin=constructed means it was built from the rule match keys because nothing on the authoring machine exercised the rule.",
  "fixtures": [
    {
      "ruleId": "LV-0001",
      "origin": "observed",
      "expect": "benign",
      "signature": {
        "Source": "event",
        "Channel": "System",
        "Provider": "Microsoft-Windows-DistributedCOM",
        "Id": 10016,
        "SampleMessage": "The application-specific permission settings do not grant Local Activation permission for the COM Server application with CLSID \r\n{2593F8B9-4EAF-457C-B68A-50F6B8EA6B54}\r\n and APPID \r\n{15C20B67-12E7-4BB6-92BB-7AFF07997402}\r\n to the user MACHINE\\user SID (S-1-5-21-<SID>) from address LocalHost (Using LRPC) running in the application container Unavailable SID (Unav"
      }
    },
    {
      "ruleId": "LV-0002",
      "origin": "observed",
      "expect": "informational",
      "signature": {
        "Source": "event",
        "Channel": "System",
        "Provider": "Microsoft-Windows-DistributedCOM",
        "Id": 10010,
        "SampleMessage": "The server {00000000-0000-0000-0000-000000000000} did not register with DCOM within the required timeout."
      }
    },
    {
      "ruleId": "LV-0003",
      "origin": "constructed",
      "expect": "investigate",
      "signature": {
        "Source": "event",
        "Channel": "System",
        "Provider": "Microsoft-Windows-DistributedCOM",
        "Id": 10005,
        "SampleMessage": "DCOM got error \"1053\" attempting to start the service BcastDVRUserService with arguments \"Unavailable\" in order to run the server: {0F8E8C1F-B2E9-4D6A-9C1B-3A4E5F6D7C8B}"
      }
    },
    {
      "ruleId": "LV-0010",
      "origin": "observed",
      "expect": "investigate",
      "signature": {
        "Source": "event",
        "Channel": "System",
        "Provider": "Microsoft-Windows-WHEA-Logger",
        "Id": 17,
        "SampleMessage": "A corrected hardware error has occurred.\r\n\r\nComponent: PCI Express Legacy Endpoint\r\nError Source: Advanced Error Reporting (PCI Express)\r\n\r\nPrimary Bus:Device:Function: 0x1:0x0:0x0\r\nSecondary Bus:Device:Function: 0x0:0x0:0x0\r\nPrimary Device Name:PCI\\VEN_10DE&DEV_2783&SUBSYS_51371462&REV_A1\r\nSecondary Device Name:"
      }
    },
    {
      "ruleId": "LV-0010",
      "name": "at the escalation rate",
      "origin": "constructed",
      "expect": "actionable",
      "perDay": 40,
      "signature": {
        "Source": "event",
        "Channel": "System",
        "Provider": "Microsoft-Windows-WHEA-Logger",
        "Id": 17,
        "SampleMessage": "A corrected hardware error has occurred. Reported by component: Processor Core."
      }
    },
    {
      "ruleId": "LV-0011",
      "origin": "constructed",
      "expect": "critical",
      "signature": {
        "Source": "event",
        "Channel": "System",
        "Provider": "Microsoft-Windows-WHEA-Logger",
        "Id": 18,
        "SampleMessage": "A fatal hardware error has occurred. Reported by component: Processor Core. Error Source: Machine Check Exception."
      }
    },
    {
      "ruleId": "LV-0012",
      "origin": "constructed",
      "expect": "investigate",
      "signature": {
        "Source": "event",
        "Channel": "System",
        "Provider": "Microsoft-Windows-WHEA-Logger",
        "Id": 19,
        "SampleMessage": "A corrected hardware error has occurred. Reported by component: Processor Core. Error Source: Corrected Machine Check. Error Type: Cache Hierarchy Error. Processor APIC ID: 4"
      }
    },
    {
      "ruleId": "LV-0020",
      "origin": "observed",
      "expect": "actionable",
      "signature": {
        "Source": "event",
        "Channel": "System",
        "Provider": "Microsoft-Windows-Kernel-Power",
        "Id": 41,
        "SampleMessage": "The system has rebooted without cleanly shutting down first. This error could be caused if the system stopped responding, crashed, or lost power unexpectedly."
      }
    },
    {
      "ruleId": "LV-0021",
      "origin": "constructed",
      "expect": "actionable",
      "signature": {
        "Source": "event",
        "Channel": "System",
        "Provider": "Microsoft-Windows-WER-SystemErrorReporting",
        "Id": 1001,
        "SampleMessage": "The computer has rebooted from a bugcheck. The bugcheck was: 0x0000007e (0xffffffffc0000005, 0xfffff8000f1a2b3c, 0xffffd0002a1b3c40, 0xffffd0002a1b3a80)."
      }
    },
    {
      "ruleId": "LV-0022",
      "origin": "observed",
      "expect": "investigate",
      "signature": {
        "Source": "event",
        "Channel": "System",
        "Provider": "EventLog",
        "Id": 6008,
        "SampleMessage": "The previous system shutdown at 5:01:15 AM on 6/24/2026 was unexpected."
      }
    },
    {
      "ruleId": "LV-0030",
      "origin": "observed",
      "expect": "actionable",
      "signature": {
        "Source": "event",
        "Channel": "System",
        "Provider": "disk",
        "Id": 51,
        "SampleMessage": "An error was detected on device \\DR7 during a paging operation."
      }
    },
    {
      "ruleId": "LV-0031",
      "origin": "observed",
      "expect": "investigate",
      "signature": {
        "Source": "event",
        "Channel": "System",
        "Provider": "disk",
        "Id": 157,
        "SampleMessage": "Disk 5 has been surprise removed."
      }
    },
    {
      "ruleId": "LV-0032",
      "origin": "constructed",
      "expect": "actionable",
      "signature": {
        "Source": "event",
        "Channel": "System",
        "Provider": "Ntfs",
        "Id": 55,
        "SampleMessage": "A corruption was discovered in the file system structure on volume C:."
      }
    },
    {
      "ruleId": "LV-0033",
      "origin": "constructed",
      "expect": "investigate",
      "signature": {
        "Source": "event",
        "Channel": "System",
        "Provider": "disk",
        "Id": 153,
        "SampleMessage": "The IO operation at logical block address 0x1a2b3c for Disk 2 (PDO name: \\Device\\0000003e) was retried."
      }
    },
    {
      "ruleId": "LV-0040",
      "origin": "observed",
      "expect": "investigate",
      "signature": {
        "Source": "event",
        "Channel": "System",
        "Provider": "Service Control Manager",
        "Id": 7031,
        "SampleMessage": "The UserDataSvc_71cc1 service terminated unexpectedly.  It has done this 1 time(s).  The following corrective action will be taken in 10000 milliseconds: Restart the service."
      }
    },
    {
      "ruleId": "LV-0040",
      "name": "at the escalation rate",
      "origin": "constructed",
      "expect": "actionable",
      "perDay": 9,
      "signature": {
        "Source": "event",
        "Channel": "System",
        "Provider": "Service Control Manager",
        "Id": 7031,
        "SampleMessage": "The Contoso Agent service terminated unexpectedly. It has done this 12 time(s)."
      }
    },
    {
      "ruleId": "LV-0041",
      "origin": "observed",
      "expect": "investigate",
      "signature": {
        "Source": "event",
        "Channel": "System",
        "Provider": "Service Control Manager",
        "Id": 7034,
        "SampleMessage": "The Gaming Services service terminated unexpectedly.  It has done this 1 time(s)."
      }
    },
    {
      "ruleId": "LV-0042",
      "origin": "observed",
      "expect": "investigate",
      "signature": {
        "Source": "event",
        "Channel": "System",
        "Provider": "Service Control Manager",
        "Id": 7000,
        "SampleMessage": "The Steam Client Service service failed to start due to the following error: \r\nThe service did not respond to the start or control request in a timely fashion."
      }
    },
    {
      "ruleId": "LV-0043",
      "origin": "observed",
      "expect": "informational",
      "signature": {
        "Source": "event",
        "Channel": "System",
        "Provider": "Service Control Manager",
        "Id": 7009,
        "SampleMessage": "A timeout was reached (30000 milliseconds) while waiting for the Steam Client Service service to connect."
      }
    },
    {
      "ruleId": "LV-0044",
      "origin": "constructed",
      "expect": "investigate",
      "signature": {
        "Source": "event",
        "Channel": "System",
        "Provider": "Service Control Manager",
        "Id": 7011,
        "SampleMessage": "A timeout (30000 milliseconds) was reached while waiting for a transaction response from the WSearch service."
      }
    },
    {
      "ruleId": "LV-0050",
      "origin": "observed",
      "expect": "investigate",
      "signature": {
        "Source": "event",
        "Channel": "Application",
        "Provider": "Application Error",
        "Id": 1000,
        "SampleMessage": "Faulting application name: python.exe, version: 3.12.10150.1013, time stamp: 0x67f515a7\r\nFaulting module name: python312.dll, version: 3.12.10150.1013, time stamp: 0x67f5153a\r\nException code: 0xc0000005\r\nFault offset: 0x0000000000083929\r\nFaulting process id: 0xB7BC\r\nFaulting application start time: 0x1DD1FBC3C027637\r\nFaulting application path: C:\\Users\\user\\AppData\\Local\\Programs\\Python\\Python312\\py"
      }
    },
    {
      "ruleId": "LV-0051",
      "origin": "constructed",
      "expect": "investigate",
      "signature": {
        "Source": "event",
        "Channel": "Application",
        "Provider": "Application Hang",
        "Id": 1002,
        "SampleMessage": "The program Explorer.EXE version 10.0.26100.1 stopped interacting with Windows and was closed."
      }
    },
    {
      "ruleId": "LV-0052",
      "origin": "observed",
      "expect": "investigate",